Pillar,Is it a pillar?,Main Keyword,Secondary Keywords,Example or Tentative Title,Content Focus,SEO Intent Type,TOFU/MOFU Level,Suggested Internal Links,Hero Image URL
Money Management,Yes,Money Management,"financial management, managing money, financial basics",Money Management: The Complete Beginner's Guide,"Complete beginner's guide on how to manage money. Includes the importance of money management, common mistakes, first steps, and links to specific topics such as budgeting, saving, apps, expense tracking, and more. This article should serve as a cornerstone and link to all related cluster articles.",Informational,TOFU,"/personal-finance/how-to-create-a-budget,/personal-finance/how-to-save-money-fast",https://media.topfinanzas.com/images/budgetbee/money-management-hero.webp
Money Management,No,personal finance,"financial planning, money management basics, personal finance guide",Personal Finance 101: The Ultimate Guide to Managing Your Money,"Comprehensive introduction to personal finance basics in the US market, covering budgeting, saving, investing, and debt management fundamentals.",Informational,TOFU,"/personal-finance/money-management-for-beginners,/personal-finance/how-to-create-a-budget",https://media.topfinanzas.com/images/budgetbee/personal-finance-hero.webp
Money Management,No,budgeting apps,"best budget app, money tracker app, finance apps",Top Budgeting Apps to Manage Your Money in 2025,Comparison of specialized apps for budget creation and tracking. Ideal for beginners looking to control expenses.,Comparational,MOFU,"/personal-finance/how-to-create-a-budget,/personal-finance/money-management-apps",https://media.topfinanzas.com/images/budgetbee/budgeting-apps.webp
Money Management,No,how to create a budget,"budgeting steps, make a budget, personal budget",How to Create a Budget (Even if You're Bad with Money),Step-by-step guide for creating a personal budget from scratch. Includes simple methods and tips for beginners.,Informational,TOFU,"/personal-finance/best-way-to-manage-money,/personal-finance/needs-vs-wants",https://media.topfinanzas.com/images/budgetbee/create-budget.webp
Money Management,No,how to save money fast,"saving tips, quick savings, save money hacks",How to Save Money Fast: 10 Hacks That Actually Work,Practical and quick tips to save money in a short time. Focused on people with limited income.,Informational,TOFU,"/personal-finance/how-to-create-a-budget,/personal-finance/personal-finance-tips",https://media.topfinanzas.com/images/budgetbee/save-money-fast.webp
Money Management,No,money management apps,"financial apps, expense tracker, budget planner",Best Money Management Apps to Simplify Your Finances,"Most comprehensive apps that help manage personal finances: budgeting, savings goals, expense tracking, and more.",Comparational,MOFU,"/personal-finance/budgeting-apps,/personal-finance/best-way-to-manage-money",https://media.topfinanzas.com/images/budgetbee/money-management-apps.webp
Money Management,No,personal finance tips,"financial advice, money tips, improve finances",10 Personal Finance Tips You Should Know by 2025,List of essential tips to improve personal finances. Aimed at a general audience looking to start organizing their money.,Informational,TOFU,"/personal-finance/money-management-for-beginners,/personal-finance/how-to-avoid-debt",https://media.topfinanzas.com/images/budgetbee/finance-tips.webp
Money Management,No,money management tips,"managing money tips, financial habits, smart spending",7 Practical Money Management Tips for Everyday Life,"Practical tips for everyday life: controlling expenses, managing income, and maintaining financial stability.",Informational,TOFU,"/personal-finance/personal-finance-tips,/personal-finance/needs-vs-wants",https://media.topfinanzas.com/images/budgetbee/practical-tips.webp
Money Management,No,how to track expenses,"expense tracking, spending tracker, monitor spending",How to Track Your Expenses Without Going Crazy,Simple methods to keep track of your expenses. Ideal for those who want to have clarity on where their money is going.,Informational,TOFU,"/personal-finance/budgeting-apps,/personal-finance/how-to-create-a-budget",https://media.topfinanzas.com/images/budgetbee/track-expenses.webp
Money Management,No,difference between needs and wants,"needs vs wants, spending habits, financial choices",Needs vs. Wants: How to Make Better Spending Decisions,Clear explanation of the difference between needs and wants. A useful tool for making better spending decisions.,Informational,TOFU,"/personal-finance/how-to-create-a-budget,/personal-finance/money-management-tips",https://media.topfinanzas.com/images/budgetbee/needs-vs-wants.webp
Money Management,No,how to avoid debt,"debt prevention, stay out of debt, debt free living",How to Avoid Debt and Still Live Well,Strategies to prevent debt without stopping enjoying life. Ideal for those seeking financial stability without extreme sacrifices.,Informational,TOFU,"/personal-finance/difference-between-needs-and-wants,/personal-finance/how-to-save-money-fast",https://media.topfinanzas.com/images/budgetbee/avoid-debt.webp
Money Management,No,best way to manage money,"money management methods, financial organization, simple finance",The Best Way to Manage Your Money (And Actually Stick to It),Simple and effective method to manage your finances month by month. Aimed at people who want order without complications.,Informational,TOFU,"/personal-finance/how-to-track-expenses,/personal-finance/money-management-apps",https://media.topfinanzas.com/images/budgetbee/best-way-manage-money.webp